{"authority":"maintainer_reviewed_key_lifecycle_event_only","effective_revision":2,"event_at":"2026-09-09T12:28:53Z","event_type":"enroll","key_id":"7768796e9f50ee4858598b5c7812071cf34c12f034df6c56d9cba8018d2fe30f","possession_proof":{"challenge":{"authority":"proof_of_possession_challenge_only_no_identity_or_role_authority","event_sha256":[],"expires_at":"2026-09-09T14:27:53Z","issued_at":"2026-09-09T12:27:53Z","key_id":"7768796e9f50ee4858598b5c7812071cf34c12f034df6c56d9cba8018d2fe30f","nonce":"YzKbyFgNEjD9Idp9Wu94o8Irh7iocvws4gYDRsfglL0=","policy_revision":1,"principal_id":"synthetic-rg14-issuer","public_key":"VYD2K90wpn/YhhyiEuEY4mKltM7tbsor2CwzvdZJnyY=","repository":"https://github.com/scruge1/universal-benchmark-evidence","roles":["issuer"],"schema":"universal-benchmark-key-possession-challenge/v1"},"sshsig":"-----BEGIN SSH SIGNATURE-----\nU1NIU0lHAAAAAQAAADMAAAALc3NoLWVkMjU1MTkAAAAgVYD2K90wpn/YhhyiEuEY4mKltM7tbsor\n2CwzvdZJnyYAAAAidW5pdmVyc2FsLWJlbmNobWFyay1rZXktZW5yb2xsbWVudAAAAAAAAAAGc2hh\nMjU2AAAAUwAAAAtzc2gtZWQyNTUxOQAAAEAm8QHbMnWaIwpxrhJ3PSV8YfeZLQ6vW04RsUOse+pJ\nWc7Hwm/JO5sayXbXERDy2srlUMTK9syifrSLGpfdHAIO\n-----END SSH SIGNATURE-----\n"},"principal_id":"synthetic-rg14-issuer","public_key":"VYD2K90wpn/YhhyiEuEY4mKltM7tbsor2CwzvdZJnyY=","reason":"synthetic RG14 hosted positive test only; never merge","roles":["issuer"],"schema":"universal-benchmark-key-event/v2"}